0,1,2,3,4
,Total,933,"37,921","6,158.34"
B,"y June 2024, Galle, Matara, and Colombo had secured the highest number of investment projects,",,,
"with 166, 89, and 86 projects, respectively. The Southern Province is increasingly recognized as a",,,,
"key area for tourism accommodation investments. Additionally, investments in Colombo, Galle, and",,,,
Gampaha are expected to contribute the most to the available room capacity. In terms of investment,,,,
"value, Colombo, Hambantota, and Galle emerged as leading regions. By June 30, 2024, a total of",,,,
"933  projects  had  been  submitted,  amounting  to  a  significant  investment  value  of  USD  6,158.34",,,,
million.,,,,
