0,1,2,3
Tourists (Sample 116),Tourist Guides (Sample,Hoteliers (Sample 101),MSMEs (Sample 312)
,300),,
"It is unarguable that the ability of TGs in Sri Lanka to speak English, Russian, German, French,",,,
and Mandarin are critical to ensure an enjoyable and memorable visit for most tourists. Based,,,
"on the most recent statistics published by SLTDA as presented below, it is clear that Indians",,,
"and Chinese are the most extensively attracted tourists to Sri Lanka. Russian, British, German,",,,
"and French are more attracted to Sri Lanka than to other Asian countries.  Therefore, it is clear",,,
that the demand for TGs can be increased by preparing them to speak these languages.,,,
