0,1
E  urope emerged as the dominant,Breaking down the countributions
"contributor to tourism in  Sri  Lanka,","further , the Americas have corntributed"
accounting for the  majority  of tourists,"7.1% to  the total  tourits arrivals  ,  while"
with a  share  of 50.5%  of  total  arrivals.,the  Middle  East  has  accounted for
"Concurrently, the  Asia  Pacific region",3.2%.These  regions  have  played  their
became the  primary source  market  for,part in  shaping  Sri  Lanka ‘s tourism
"tourist  traffic  to  Sri  Lanka,  constituting",landscape.
