0,1,2,3,4,5
L,argest  share  of,"international  arrivals,",representing  20.4%  of,the,total.  The  Russian
"Federation emerged as the second-largest country of origin, contributing 13.3% of arrivals.",,,,,
"The  United  Kingdom  ranked  third  with  an  8.7%  share,  followed  by  Germany  at  6.9%  and",,,,,
"China at 4.6%, making them the fourth and fifth largest markets, respectively. Collectively, the",,,,,
top ten markets represented 70.8% of the total tourist traffic to the country in 2023.,,,,,
"An analysis  of  the percentage  change  since  2018  reveals  that  all countries,  except  for  the",,,,,
"Russian Federation, France, and the Maldives, have seen declines, while these three markets",,,,,
recorded improvements.,,,,,
