0,1
ummary,
The total  number  of international tourist,"As of 31st October 2022, 568,268"
arrivals  to  Sri  Lanka  during  October  2022,international tourists had visited Sri Lanka
"was 42,026. Tourist arrivals for the month",for  this  year.  The  largest  source  markets
"of October have plunged by almost 60.5%,",recorded  for  the  month  of  October  were
"in comparison to  March 2022,  which","India,  Russian  Federation, the  United"
recorded the  highest  number  of tourist,"Kingdom,  Australia,  followed  by  Maldives"
"arrivals up to October, 2022.",and Canada.
