0,1
Netherlands,
An  analysis  of the ten  major source  markets,Kingdom was the third major source of tourists to
revealed  that  tourists  from  India  represented  the,"the country (10.9%), while Germany (6.7%) Australia"
largest number of interna(cid:415) onal arrivals. China was,(4.7%) become fourth and ﬁ (cid:332) h in the top ﬁ ve markets.
recorded as the second major country of origin for,The top ten markets accounted for almost 68.1% of
tourists with a share of 11.3% during 2018. United,the total tourist traﬃ  c to the country in 2018.
